{
  "credential_id": "credential_receiving_resume",
  "deletion_id": "deletion_synthetic",
  "message_type": "deletion_request",
  "protocol_version": "tacua.sdk-backend@1.0.0",
  "reason": "user_requested",
  "request_digest": "sha256:576428a987a77d6da1691b0cb85ed2f1b4457c92ff232060c78cbd221af8cbc8",
  "requested_at": "2026-07-21T10:03:00Z",
  "scope_digest": "sha256:c38600d56cdb3bc8a0d94c0dd7e6323f863d1ccbc6953b6c71421e7c08512a20",
  "session_id": "session_synthetic",
  "target": "session_all_data"
}
